<?xml version="1.0" encoding="UTF-8"?>
<?xml-stylesheet type = "text/xsl" href = "serious-video-games.xsl"?>

<!DOCTYPE catalogue SYSTEM "serious-video-games.dtd">

<catalogue>
  <genres>
    <genre id="gr-0001" title="Games for Health" >
      <image source="health_title"/>
      <description>
        Games for Health are games that aim to either promote 
        health or to prevent, diagnose or treat (chronic) diseases. 
        These games, which are generally considered serious games, 
        aim to influence health outcomes by increasing the user's 
        knowledge and changing their behaviors through play.
      </description>
    </genre>
    <genre id="gr-0002" title="Advergames">
      <image source="advergames_title"/>
      <description>
        An advergame is a form of advertising in video games, 
        in which the video game is developed by or in close 
        collaboration with a corporate entity for purposes of 
        advertising a brand-name product. While other video games 
        may use in-game advertising (such as an advertisement 
        on a virtual billboard or branding on an in-game object), 
        an advergame is differentiated by the Interactive 
        Advertising Bureau as a "game specifically designed 
        around product or service being advertised". 
      </description>
    </genre>
    <genre id="gr-0003" title="Games for Training">
      <image source="training_title"/>
      <description>
        Games for training, also known as serious 
        games or edutainment games, are video games 
        that are designed to educate or train players 
        in a specific subject or skill. These games are 
        often used in education, corporate training, and 
        military training, and can be used to teach a wide 
        variety of topics, such as leadership, teamwork, 
        problem-solving, and technical skills. Games for 
        training can be effective at engaging and motivating 
        learners, and can be used to supplement traditional 
        teaching methods or to create immersive, interactive 
        learning experiences.
      </description>
    </genre>
    <genre id="gr-0004" title="Games for Education">
      <image source="education_title"/>
      <description>
        Educational games are games explicitly designed with 
        educational purposes, or which have incidental or 
        secondary educational value. All types of games may 
        be used in an educational environment, however 
        educational games are games that are designed to 
        help people learn about certain subjects, expand 
        concepts, reinforce development, understand a historical 
        event or culture, or assist them in learning a skill 
        as they play. Game types include board, card, and 
        video games.
      </description>
    </genre>
    <genre id="gr-0005" title="Games for Science and Research">
      <image source="science_title"/>
      <description>
        Games for science and research often have a specific scientific or research-related goal,
        such as mapping the brain, collecting data on spatial navigation,
        or identifying patterns in DNA sequences. Games for science and 
        research can be used to engage the general public in scientific 
        research, to collect data that would be difficult or impossible 
        to gather through traditional means, or to help researchers understand 
        complex systems or solve problems. These games can be an effective way 
        to promote scientific literacy and encourage people to learn about and 
        contribute to scientific research.
      </description>
    </genre>
    <genre id="gr-0006" title="Production">
      <image source="production_title"/>
      <description>
        Games for production, also known as factory simulation games
        or tycoon games, are video games that simulate the management
        and operation of a production facility. These games often involve
        tasks such as gathering resources, building structures and machines,
        and automating production processes in order to create a product or 
        service. Games for production can be used to teach players about
        various aspects of production, such as supply chain management,
        resource allocation, and quality control. These games can also
        be used to challenge players to find the most efficient and
        effective ways to produce goods or services.
      </description>
    </genre>
    <genre id="gr-0007" title="Games as Work">
      <image source="work_title"/>
      <description>
        Games for work, also known as gamification or gamified training,
        are video games or game-like elements that are used to engage 
        and motivate employees in their work. These games can be used 
        to teach new skills, encourage teamwork and collaboration, 
        or improve productivity. Games for work can be incorporated 
        into training programs, used as part of a rewards or recognition system, 
        or implemented as part of a company's culture and values. Gamification 
        can be an effective way to engage and motivate employees, and can be 
        used in a variety of industries and settings.
      </description>
    </genre>
  </genres>
  <sectors>
    <sector id="sr-0001" title="Government &amp; NGO">
      <image source="government_sector"/>
      <description>
        A government and NGO serious game is a type of simulation game that is used by government 
        agencies and non-governmental organizations (NGOs) to train employees, educate the public, and solve problems. 

        These games can be used to train employees in a variety of skills, such as leadership, 
        teamwork, and problem-solving. They can also be used to educate the public about a particular issue, or to 
        explore different approaches to solving problems.

        Government and NGO serious games can be played on a computer, or they can be played in a physical setting. 

        Overall, government and NGO serious games are an important tool for these organizations to train and prepare 
        employees, and to educate the public and explore new approaches to solving problems.
      </description>
    </sector>
    <sector id="sr-0002" title="Defense">
      <image source="defense_sector"/>
      <description>
        A defense serious game is a type of simulation game that is used by military and 
        defense organizations to train personnel, plan strategies, and test new equipment.

        These games can be used to train personnel in a variety of skills, including 
        combat tactics, leadership, and decision-making. They can also be used to test new 
        equipment or to explore different strategies and scenarios.

        Defense serious games can be played on a computer, or they can be played in a physical
        setting with simulated equipment. 

        Overall, defense serious games are an important tool for military and defense organizations
        to train and prepare personnel for a wide range of real-world situations.
      </description>
    </sector>
    <sector id="sr-0003" title="Healthcare">
      <image source="healtchcare_sector"/>
      <description>
        A healthcare serious game is a type of simulation game that is used in the healthcare 
        industry to train professionals, educate the public, and explore different treatment options.
        
        These games can be used to train professionals in a variety of skills,
        including patient care, diagnosis, and treatment. They can also be used to educate
        the public about health issues or to explore different treatment options.

        Healthcare serious games can be played on a computer, or they can be played
        in a physical setting with simulated equipment. 

        Overall, healthcare serious games are an important tool for the healthcare industry to train and prepare 
        professionals and to explore new treatment options.
      </description>
    </sector>
    <sector id="sr-0004" title="Marketing &amp; Communications">
      <image source="marketing_sector"/>
      <description>
        A marketing and communications serious game is a type of simulation 
        game that is used by organizations to train employees in marketing
        and communications skills, and to explore different marketing and 
        communication strategies. 

        Marketing and communications serious games can be used to train employees 
        in a variety of skills, including sales, advertising, and public relations. 
        They can also be used to explore different marketing and communication strategies, 
        and to test the effectiveness of different messages and campaigns.

        Marketing and communications serious games can be played on a computer, 
        or they can be played in a physical setting. 

        Overall, marketing and communications serious games are an important tool for organizations to 
        train and prepare employees in marketing and communication skills, and to explore new strategies.
      </description>
    </sector>
    <sector id="sr-0005" title="Education">
      <image source="education_sector"/>
      <description>
        An education serious game is a type of game that is designed to teach players about
        a particular subject or issue in an interactive and engaging way. These games 
        are often used in formal education settings, such as schools and universities, 
        as well as in other settings, such as museums and science centers.

        Education serious games can cover a wide range of subjects, from math and science